{
  "type": "object",
  "properties": {
    "eventId": {
      "type": "string",
      "format": "uuid"
    },
    "eventType": {
      "const": "devsync.index.requested.v1"
    },
    "schemaVersion": {
      "const": 1
    },
    "occurredAt": {
      "type": "string",
      "format": "date-time"
    },
    "workspaceId": {
      "type": "string",
      "format": "uuid"
    },
    "projectId": {
      "type": "string",
      "format": "uuid"
    },
    "jobId": {
      "type": "string",
      "format": "uuid"
    },
    "traceparent": {
      "type": "string",
      "pattern": "^00-[0-9a-f]{32}-[0-9a-f]{16}-[0-9a-f]{2}$"
    },
    "payload": {
      "type": "object",
      "properties": {
        "generationId": {
          "type": "string",
          "format": "uuid"
        },
        "commitSha": {
          "type": "string",
          "pattern": "^[0-9a-f]{40,64}$"
        }
      },
      "required": [
        "generationId",
        "commitSha"
      ],
      "additionalProperties": false
    }
  },
  "required": [
    "eventId",
    "eventType",
    "schemaVersion",
    "occurredAt",
    "workspaceId",
    "projectId",
    "jobId",
    "traceparent",
    "payload"
  ],
  "additionalProperties": false,
  "$schema": "https://json-schema.org/draft/2020-12/schema",
  "$id": "urn:devsync:event:index-requested:v1",
  "title": "devsync.index.requested.v1"
}
